"Collège";"Mention";"Parcours";"Campus";"Contact"
"SSH";"Arts, lettres et civilisations (LiLAC)";"Études anglophones";"Pau";"Viviane Babeix"
"SSH";"Arts, lettres et civilisations (LiLAC)";"Études hispaniques";"Pau";"Christel Barbisan"
"SSH";"Arts, lettres et civilisations (LiLAC)";"Lettres et arts";"Pau";"Agnès Lavoinne"
"SSH";"Français langue étrangère (FLE) ";"FLE - Généraliste";"Pau";"Agnès Lavoinne"
"SSH";"Français langue étrangère (FLE) ";"FLE - PostGraduate Certificate in Education (PGCE)";"Pau";"Agnès Lavoinne"
"SSH";"Langues Étrangères Appliquées (L.E.A.) ";"Traduction, terminologie, documentation";"Pau";"Christel Barbisan"
"SSH";"Droit de l'entreprise ";"Juriste d’affaires";"Pau";"Ana do Rosario Vicente"
"SSH";"Droit de l'entreprise ";"Juriste d’affaires franco-espagnol";"Pau";"Ana do Rosario Vicente"
"SSH";"Droit de l'entreprise ";"Droit de la consommation";"Pau";"Ana do Rosario Vicente"
"SSH";"Droit notarial";"Droit notarial";"Pau";"Ana do Rosario Vicente"
"SSH";"Droit privé ";"Droit privé général";"Pau";"Ana do Rosario Vicente"
"SSH";"Droit privé ";"Procédures et contentieux privés";"Pau";"Ana do Rosario Vicente"
"SSH";"Droit privé ";"Droit des transitions énergétiques et environnementales";"Pau";"Ana do Rosario Vicente"
"SSH";"Droit public";"Cadre du secteur sanitaire, social et médico-social";"Pau";"Ana do Rosario Vicente"
"SSH";"Droit public";"Droit et action publique locale";"Pau";"Ana do Rosario Vicente"
"SSH";"Droit public";"Droit et contentieux des contrats et des libertés";"Pau";"Ana do Rosario Vicente"
"SSH";"Droit pénal et sciences criminelles ";"Droit de l’exécution des peines et droits de l’homme";"Pau";"Ana do Rosario Vicente"
"SSH";"Droit pénal et sciences criminelles ";"Police et sécurité intérieure";"Pau";"Ana do Rosario Vicente"
"SSH";"Économie appliquée ";"Chargé d’études économiques et de marché";"Pau";"Lina Goncalves"
"SSH";"Économie appliquée ";"Europe, International, environnement et développement";"Pau";"Lina Goncalves"
"SSH";"Géographie, aménagement, environnement et développement";"Transitions environnementales, société, territoire";"Pau";"Sandra Grandcolas"
"SSH";"Histoire, civilisations, patrimoine ";"Histoire et anthropologie";"Pau";"Laurence Palazzi"
"SSH";"Histoire, civilisations, patrimoine ";"Arts et Archéologie préventive";"Pau";"Laurence Palazzi"
"SSH";"Patrimoine et musées ";"Valorisation et médiation des patrimoines";"Pau";"Laurence Palazzi"
"SSH";"Science de la durabilité - Sustainability Science";"Applied Social Sciences in Energy and Environmental Transitions (ASSET) – Economic Specialization";"Pau";"Lina Goncalves"
"SSH";"Science de la durabilité - Sustainability Science";"Applied Social Sciences in Energy and Environmental Transitions (ASSET) – Geographic Specialization";"Pau";"Sandra Grandcolas"
"SSH";"Sociologie ";"Jeunesse, mobilisations et environnement";"Pau";"Mariluz Toro"
"SSH";"Tourisme";"Loisirs, tourisme et développement territorial";"Pau";"Sandra Grandcolas"
"SSH";"MEEF Lettres et Langues";"MEEF : Anglais";"Pau";"Viviane Babeix"
"SSH";"MEEF Lettres et Langues";"MEEF : Espagnol";"Pau";"Christel Barbisan"
"SSH";"MEEF Lettres et Langues";"MEEF : Histoire Géographie";"Pau";"Laurence Palazzi"
"SSH";"MEEF Lettres et Langues";"MEEF : Lettres classiques";"Pau";"Agnès Lavoinne"
"SSH";"MEEF Lettres et Langues";"MEEF : Lettres modernes";"Pau";"Agnès Lavoinne"
"SSH";"MEEF Éducation physique et sportive ";"MEEF : Education physique et sportive";"Tarbes";"Agnès Martin"
"SSH";"STAPS Entraînement et optimisation de la performance sportive (EOPS) ";"STAPS : Expert en préparation physique et mentale et optimisation de la performance";"Tarbes";"Agnès Martin"
"E2I";"Comptabilité - contrôle - audit";"Comptabilité - contrôle - audit";"Pau";"Lina Goncalves"
"E2I";"Contrôle de gestion et audit organisationnel";"Contrôle de gestion et audit organisationnel";"Pau";"Lina Goncalves"
"E2I";"Entrepreneuriat et management de projets ";"Ingénierie de projet";"Bidart";"Mikel Urrutia"
"E2I";"Études européennes et internationales ";"Coopérations transfrontalières et interterritoriales";"Bayonne";"Valérie Garrec"
"E2I";"Études européennes et internationales ";"Droit européen des affaires et du numérique";"Bayonne";"Valérie Garrec"
"E2I";"Études européennes et internationales ";"Droit interne et européen des mineurs";"Bayonne";"Valérie Garrec"
"E2I";"Études européennes et internationales ";"Droit européen de l’action publique";"Bayonne";"Valérie Garrec"
"E2I";"Études européennes et internationales ";"Droit pénal européen et international";"Bayonne";"Valérie Garrec"
"E2I";"Management des organisations de santé (MOS) ";"Management des organisations sanitaires et médico-sociales, bien être et santé";"Bayonne";"Mikel Urrutia"
"E2I";"Management des systèmes d'information ";"Management des organisations et technologies de l’information";"Pau";"Lina Goncalves"
"E2I";"Management et administration des entreprises ";"Certificat d’aptitude à l’administration des entreprises";"Pau";"Lina Goncalves"
"E2I";"Management et administration des entreprises ";"Management et administration des entreprises : ENSGTI";"Pau";"Lina Goncalves"
"E2I";"Management et administration des entreprises ";"European and international business studies";"Bayonne";"Mikel Urrutia"
"E2I";"Management et commerce international ";"International trade";"Bayonne";"Mikel Urrutia"
"E2I";"Management et commerce international ";"Achats et logistique internationale";"Bayonne";"Mikel Urrutia"
"E2I";"Management et commerce international ";"Management international Amérique latine";"Bayonne";"Mikel Urrutia"
"E2I";"Management public ";"Management des organisations territoriales";"Pau";"Lina Goncalves"
"E2I";"Management public ";"Management et innovation en collectivités locales";"Pau";"Lina Goncalves"
"E2I";"Management sectoriel ";"Conseiller spécialisé banque et assurances";"Bayonne";"Mikel Urrutia"
"STEE";"Chimie et sciences du vivant ";"Evaluation, gestion et traitement des pollutions";"Pau";"Julien Rabaud"
"STEE";"Chimie et sciences du vivant ";"Sciences analytiques pour le vivant et l’environnement";"Pau";"Julien Rabaud"
"STEE";"Chimie et sciences du vivant ";"Biologie moléculaire et microbiologie de l’environnement";"Pau";"Julien Rabaud"
"STEE";"Chimie et sciences du vivant ";"Chemical and microbiological Characterization for environmental issues";"Pau";"Julien Rabaud"
"STEE";"Chimie et sciences du vivant ";"Graduate program GREEN - Environmental analytical chemistry and microbiology";"Pau";"Julien Rabaud"
"STEE";"Génie industriel ";"Eco-ingénierie";"Anglet";"Florence Breton"
"STEE";"Géoenergies ";"Simulation et optimisation des systèmes énergétiques";"Pau";"Julien Rabaud"
"STEE";"Géoenergies ";"Géologie Géophysique pour les géoénergies (G3)";"Pau";"Julien Rabaud"
"STEE";"Géoenergies ";"Sciences de l’Ingénieur pour les géoénergies (SG)";"Pau";"Julien Rabaud"
"STEE";"Géoenergies ";"Geoenergineering";"Pau";"Julien Rabaud"
"STEE";"Géoenergies ";"Graduate program GREEN - Sustainable geoenergies ";Pau;Julien Rabaud
"STEE";"Informatique";"Technologies de l’internet";"Pau";"Julien Rabaud"
"STEE";"Informatique";"Systèmes informatiques pour le génie de la logistique industrielle et des services";"Anglet";"Florence Breton"
"STEE";"Informatique";"Industry 4.0";"Anglet";"Florence Breton"
"STEE";"Mathématiques et applications ";"Mathématique, modéliation et simulation";"Pau";"Julien Rabaud"
"STEE";"Mathématiques et applications ";"Méthodes stochastiques et informatiques pour la décision";"Pau";"Julien Rabaud"
"STEE";"Mathématiques et applications ";"Mathématiques et Informatique pour le Big Data";"Pau";"Julien Rabaud"
"STEE";"Mathématiques et applications ";"Graduate Program GREEN - Mathematics, modeling and applications to energy and environment ";Pau;Julien Rabaud
"STEE";"Sciences de l'eau ";"Dynamique des ecosystèmes aquatiques";"Anglet";"Florence Breton"
"STEE";"Sciences de l'eau ";"Qualité des milieux aquatiques";"Anglet";"Florence Breton"
"STEE";"Sciences de l'eau ";"Evolutionary ecology in aquatic environments";"Anglet";"Florence Breton"
"STEE";"Sciences de l'eau ";"Erasmus Mundus - Environmental contamination and toxicology";"Anglet";"Florence Breton"
"STEE";"Sciences et génie des matériaux ";"Ingénierie des matériaux : élaboration, caractérisation et applications";"Pau";"Julien Rabaud"
"STEE";"Sciences et génie des matériaux ";"Chimie et physico-chimie des matériaux";"Pau";"Julien Rabaud"
"STEE";"Sciences et génie des matériaux ";"Matériaux bio-inspirés international";"Pau";"Julien Rabaud"
"STEE";"Sciences et génie des matériaux ";"Graduate program GREEN - Materials inspired by nature and for energy and sustainable technology ";"Pau";"Julien Rabaud"
"STEE";"MEEF Mathématiques, Physique, Chimie ";"2nd degré Mathématiques";"Pau";"Julien Rabaud"
"STEE";"MEEF Mathématiques, Physique, Chimie ";"2nd degré Physique-Chimie";"Pau";"Julien Rabaud"
